{"acceptance_report":{"artifact_id":"rcid:v1:trust-assessment:h:jcs-sha256-v1:ab0f1345187a33be50a9b6134a093e964bd11bfa809974654ca95f39782dd0be","digest_sha256":"3916de4eedf87ac85512c5b07fd22ad8527dd1ba3806bc20270b67194bd8155d","file_sha256":"57448e7e3257868e5aba60bba522d51a3ca2b091fd8a48e833a1220ab1818d43","path":"reports/applicability/conditional-requirement-applicability-2026-09-10.v1.json"},"current_contract":{"artifact_id":"rcid:v1:trust-policy-revision:h:jcs-sha256-v1:3215fba6a702763b56fd9cbb87e337cf9b103d96c033214c6cc1a07bea61b331","digest_sha256":"a31c2a70e54646dd2b48c1ea8012f87ca369cd59225fb5911d58fb9616f1ed34","file_sha256":"6ea8ef6daf6e15187aa20cbef836da14e27de1c25ea1a4232c9f218a61cef221","path":"applicability/contracts/regex-conformance-conditional-applicability-2026-09-10.v1.json"},"governance":{"expected_result_owner":"oracle/evidence authority, never applicability","not_applicable_is_unsupported":false,"profile_applicability_owner":"this exact contract plus an immutable profile-capability snapshot","semantic_requirement_existence_owner":"canonical semantic denominator"},"historical_compatibility":{"campaign_expectations_rewritten":false,"later_fact_snapshots_create_new_evaluations":true,"observations_reinterpreted":false,"requirements_rewritten":false},"index_digest_sha256":"bddcf05cddd6a085ea008b1f0e121c7bbed5b40cb09487ac5c3c3435e8ffe1cc","index_id":"rcid:v1:applicability-policy:h:jcs-sha256-v1:377f4025d5d354a9abcd3d8c5e086214ca3ec972750ad3259fed4b9e4bedf6f7","next_interfaces":{"claims_and_adjudication":"deferred","empirical_profile_capability_freeze":"deferred","production_vectors":"deferred","real_profile_expansion":"deferred"},"profile_expansion_handoff":{"artifact_id":"rcid:v1:ontology-projection:h:jcs-sha256-v1:6d50a66b9d60b37724f6de3a15e548309e2ff6aa2fb5daef82adbcf6d4f82265","digest_sha256":"181bcf8c60c9f22c3545ba9c0238fda9d82b83976715d4a21945be5e5c219743","file_sha256":"25ba0ce27087d7e4ecbffeec9c9ae6c0659f8909ad35c39a6571cd5626e62d72","path":"ontology/projections/regex-semantic-profile-expansion-handoff-2026-09-10.v1.json"},"requirement_authority":{"artifact_id":"rcid:v1:ontology-snapshot:h:jcs-sha256-v1:0d1e0a5375bad7d176ccf910097a23cb6cd2bd8cebd3c03faade67d5250a09af","digest_sha256":"a24769212046168016e839ac3ac8da92280b4022377f48c85ebcd40533a806fa","file_sha256":"6c7bb486760fa9cce52a6692a61aff074407899577573029b24e37cd34ecf9ec","path":"vectors/requirements/regex-semantic-vector-requirements-2026-09-08.v2.json"},"schema_version":"conditional-applicability-authority.v1","validation_fixture":{"artifact_id":"rcid:v1:expectation-projection:h:jcs-sha256-v1:2df9b3965983f39ccdebe4e7fc9b25cdb6e20426d15f2b69f5d863ea101abf0c","digest_sha256":"d83809898da8d739975897afe8c023a227bf484b49ab6e865093020bc004c4fc","file_sha256":"95dc146270b4c4ca9b10eab7a4f7fefb3ee36b2459bfe8c449de6617d2819369","path":"tests/fixtures/applicability/conditional-requirement-applicability.v1.json"}}
